{
  "$schema": "./contract.schema.json",
  "bank": "BANCO DAVIVIENDA S.A.",
  "nit": "860.034.313-7",
  "version": "1.0.0",
  "generatedAt": "2026-07-05",
  "sources": {
    "natural": {
      "bucket": "cancelaciones-plantillas",
      "path": "davivienda/EJEMPLO_REFERENCIA_PROSA_NATURAL_DAVIVIENDA.docx",
      "size": 82432,
      "etag": "9ae87c0fb6896c95bcb9cd018ad70301",
      "capturedAt": "2026-07-05"
    },
    "juridica": {
      "bucket": "cancelaciones-plantillas",
      "path": "davivienda/EJEMPLO_REFERENCIA_PROSA_JURIDICA_DAVIVIENDA.docx",
      "size": 42305,
      "etag": "58b4aeb0cb44b0941e2dad5a049c41c3",
      "capturedAt": "2026-07-05"
    }
  },
  "ocrSchemaPaths": [
    { "path": "entidad_bancaria", "level": "required", "case": ["natural", "juridica"] },
    { "path": "apoderado_nombre", "level": "required", "case": ["natural", "juridica"] },
    { "path": "apoderado_cedula", "level": "required", "case": ["natural", "juridica"] },
    { "path": "escritura_poder_num", "level": "required", "case": ["natural"] },
    { "path": "fecha_poder", "level": "required", "case": ["natural"] },
    { "path": "notaria_poder", "level": "required", "case": ["natural"] },
    { "path": "has_apoderado_banco_v3", "level": "required", "case": ["natural", "juridica"] },
    { "path": "poderdante.entidad_nombre", "level": "required", "case": ["natural", "juridica"] },
    { "path": "poderdante.entidad_nit", "level": "required", "case": ["natural", "juridica"] },
    { "path": "poderdante.representante_legal_nombre", "level": "required", "case": ["juridica"] },
    { "path": "poderdante.representante_legal_cedula", "level": "required", "case": ["juridica"] },
    { "path": "poderdante.representante_legal_cargo", "level": "recommended", "case": ["juridica"] },
    { "path": "poderdante.representante_legal_cedula_expedida_en", "level": "recommended", "case": ["juridica"] },
    { "path": "apoderado.tipo", "level": "required", "case": ["natural", "juridica"] },
    { "path": "apoderado.nombre", "level": "required", "case": ["natural"] },
    { "path": "apoderado.cedula", "level": "required", "case": ["natural"] },
    { "path": "apoderado.sociedad_razon_social", "level": "required", "case": ["juridica"] },
    { "path": "apoderado.sociedad_nit", "level": "required", "case": ["juridica"] },
    { "path": "apoderado.sociedad_constitucion.tipo_documento", "level": "required", "case": ["juridica"] },
    { "path": "apoderado.sociedad_constitucion.numero", "level": "required", "case": ["juridica"] },
    { "path": "apoderado.sociedad_constitucion.fecha", "level": "required", "case": ["juridica"] },
    { "path": "apoderado.sociedad_constitucion.camara_comercio_ciudad", "level": "required", "case": ["juridica"] },
    { "path": "apoderado.sociedad_constitucion.camara_comercio_numero", "level": "required", "case": ["juridica"] },
    { "path": "apoderado.sociedad_constitucion.libro", "level": "required", "case": ["juridica"] },
    {
      "path": "apoderado.sociedad_constitucion.razon_social_anterior",
      "level": "conditional",
      "requiredIf": "apoderado.sociedad_constitucion.reforma_acta_numero != null",
      "case": ["juridica"],
      "rationale": "Solo obligatorio si documentalmente hubo cambio de razón social."
    },
    {
      "path": "apoderado.sociedad_constitucion.reforma_acta_numero",
      "level": "conditional",
      "requiredIf": "apoderado.sociedad_constitucion.razon_social_anterior != null",
      "case": ["juridica"]
    },
    { "path": "apoderado.representantes", "level": "required", "case": ["juridica"] },
    { "path": "instrumento_poder.escritura_num", "level": "required", "case": ["juridica"] },
    { "path": "instrumento_poder.fecha", "level": "required", "case": ["juridica"] },
    { "path": "instrumento_poder.notaria_numero", "level": "required", "case": ["juridica"] },
    { "path": "instrumento_poder.notaria_ciudad", "level": "required", "case": ["juridica"] }
  ],
  "prosaAsserts": {
    "natural": {
      "required": [
        "COMPARECIÓ:",
        "APODERADA GENERAL",
        "BANCO DAVIVIENDA S.A.",
        "NIT: 860.034.313-7",
        "PRIMERO.-",
        "escritura pública número",
        "notaría",
        "AUTORIZA que el presente instrumento sea suscrito"
      ],
      "forbidden": ["___________", "N/A", "ilegible", "undefined", "null"]
    },
    "juridica": {
      "required": [
        "COMPARECIÓ:",
        "en su calidad de representante legal de la sociedad",
        "sociedad que actúa como apoderada general del BANCO DAVIVIENDA S.A.",
        "NIT: 860.034.313-7",
        "Notaría",
        "Círculo de",
        "escritura pública número",
        "poder general conferido por"
      ],
      "forbidden": ["___________", "N/A", "ilegible", "undefined", "null"],
      "conditionalRequired": {
        "cuandoHayReforma": {
          "when": "sociedad_constitucion.razon_social_anterior != null",
          "mustContain": ["cambio su razón social por"]
        }
      }
    }
  },
  "stylistic": {
    "uppercaseEntities": ["BANCO DAVIVIENDA S.A."],
    "connectivesOrder": ["COMPARECIÓ:", "PRIMERO.-"]
  }
}
